{
  "id": "print-g7h8i9",
  "person_id": "person-g7h8i9",
  "modality": "face",
  "model_id": "sface-2021dec",
  "model_sha256": "0ba9fbfa01b5270c96627c4ef784da859931e02f04419c829e83484087c34e79",
  "dim": 4,
  "embedding": [-0.11, 0.22, -0.33, 0.44],
  "captured_by": "bot:reachy-mini",
  "consent_at": "2026-09-28T12:10:00Z",
  "consented_by_person_id": "person-a1b2c3",
  "created_at": "2026-09-28T12:10:00Z",
  "updated_at": "2026-09-28T12:10:00Z",
  "deleted_at": null,
  "hlc": "1759061400000:0:g7h8i9"
}
