{
  "id": "print-d4e5f6",
  "person_id": "person-a1b2c3",
  "modality": "voice",
  "model_id": "campplus-sv-en-voxceleb",
  "model_sha256": "357a834f702b80161e5b981182c038e18553c1f2ca752ed6cec2052365d4129b",
  "dim": 4,
  "embedding": [0.21, 0.43, -0.65, 0.87],
  "captured_by": "pwa",
  "consent_at": "2026-09-28T12:05:00Z",
  "consented_by_person_id": "person-a1b2c3",
  "created_at": "2026-09-28T12:05:00Z",
  "updated_at": "2026-09-28T12:05:00Z",
  "deleted_at": null,
  "hlc": "1759061100000:0:d4e5f6"
}
